{
  "schema_version": "1.0",
  "contract_id": "cold-truth.research-verifier",
  "contract_version": "1.0.0-c2-fixture",
  "run_id": "phase-c2-research-verifier-fixture",
  "case_id": "glass-river-research-fixture",
  "stage": "research_verification_fixture",
  "attempt": 1,
  "idempotency_key": "0000000000000000000000000000000000000000000000000000000000000000",
  "status": "success",
  "started_at": "2026-07-11T00:00:00Z",
  "completed_at": "2026-07-11T00:00:00Z",
  "inputs": [
    {
      "name": "synthetic_research_boundaries",
      "type": "synthetic_research_boundaries",
      "kind": "file",
      "path": "C:\\Youtube Automation Obsidian\\automation\\fixtures\\real_research_verifier_fixture_workspace\\synthetic_research_boundaries.json",
      "sha256": "a5520081d2f02ce440473fe73af5a70a6c3a1419c24880a92f9e3314a0837e47",
      "size_bytes": 873
    },
    {
      "name": "synthetic_source_ledger",
      "type": "synthetic_source_ledger",
      "kind": "file",
      "path": "C:\\Youtube Automation Obsidian\\automation\\fixtures\\real_research_verifier_fixture_workspace\\synthetic_source_ledger.json",
      "sha256": "a23c6997e308879462eeab48f9531b578405c8f5a389f155a519761247c66150",
      "size_bytes": 1118
    },
    {
      "name": "synthetic_strategist_handoff",
      "type": "synthetic_strategist_handoff",
      "kind": "file",
      "path": "C:\\Youtube Automation Obsidian\\automation\\fixtures\\real_research_verifier_fixture_workspace\\synthetic_strategist_handoff.json",
      "sha256": "718d39271431c472b0c74bb551b04c51c963a16317946c057e0a2598f0dd3b69",
      "size_bytes": 340
    }
  ],
  "outputs": [],
  "result": {
    "upstream_strategist_handoff_hash": "718d39271431c472b0c74bb551b04c51c963a16317946c057e0a2598f0dd3b69",
    "ledger_hash": "a23c6997e308879462eeab48f9531b578405c8f5a389f155a519761247c66150",
    "boundaries_hash": "a5520081d2f02ce440473fe73af5a70a6c3a1419c24880a92f9e3314a0837e47",
    "source_conflicts": [
      "SYN-RV-X3: source_ledger_conflict"
    ],
    "unsupported_or_creator_derived_material": [
      "SYN-RV-X1",
      "SYN-RV-X2"
    ],
    "verification_status": "approved_with_exclusions",
    "proceed_to_writer": true,
    "required_human_escalation": false,
    "artifact_hashes": {},
    "external_research_performed": false,
    "browser_used": false,
    "mcp_used": false,
    "network_used": false,
    "approved_claim_ids": [
      "SYN-RV-01",
      "SYN-RV-02",
      "SYN-RV-03"
    ],
    "rejected_claims": [
      {
        "claim_id": "SYN-RV-X1",
        "reason_code": "unverified_unnamed_allegation"
      },
      {
        "claim_id": "SYN-RV-X2",
        "reason_code": "unverified_online_theory"
      },
      {
        "claim_id": "SYN-RV-X3",
        "reason_code": "source_ledger_conflict"
      }
    ]
  },
  "decisions": [
    {
      "rule": "synthetic_fixture_only",
      "result": "pass"
    }
  ],
  "warnings": [],
  "errors": [],
  "retryable": false,
  "tool_calls": [],
  "runtime": {
    "provider": "codex-exec",
    "runtime": "controlled-real-fixture",
    "model": "not-reported",
    "version": "not-reported"
  },
  "publishing_enabled": false,
  "real_production_enabled": false
}
